{"schemaVersion":"0.1","kind":"pi-session-v3-import-report","status":"completed_with_warnings","source":{"format":"pi-session-v3","version":3,"sessionId":"pi-v3-fixture-session","sha256":"f31b9b7a784a3af526fec462e5b16c5bffaaedf45b7a8fa101d946bfd3d02b39","byteLength":4396,"referenceCommit":"3f9aa5d10b35223abf6146f960ff5cb5c68053ee","sourcePathDisposition":"not_persisted"},"target":{"sessionId":"session-import-pi-v3-fixture","reportArtifactId":"artifact-pi-v3-import-report"},"counts":{"sourceEntries":17,"targetRecords":20,"mappedSourceEntries":13,"extensionSourceEntries":4,"reportedSourceEntries":5,"redactedValues":0,"skippedSourceEntries":0},"warnings":["compaction_details_quarantined","compaction_summary_usage_unavailable","custom_message_context_excluded","custom_semantics_excluded","label_semantics_extension_only","source_path_not_persisted","unknown_entry_type"],"entries":[{"sourceLine":8,"sourceEntryId":"pi-compaction-1","sourceType":"compaction","disposition":"mapped_with_loss","reasonCodes":["compaction_details_quarantined","compaction_summary_usage_unavailable"],"sourceLineSha256":"a02cd0a317bcba7366d0239e4d1bc258b86b7347792d4989cdd8e90e0d119334","targetRecordIds":["record-pi-compaction-summary","record-pi-compaction-1"],"contextExcluded":false,"quarantinedValue":{"details":{"fixtureVersion":1,"state":{"counter":2}},"fromHook":false}},{"sourceLine":9,"sourceEntryId":"pi-custom-1","sourceType":"custom","disposition":"preserved_extension","reasonCodes":["custom_semantics_excluded"],"sourceLineSha256":"50d6cdccc6ae680b6256964bc6a722587427f5bee1883982e5f3207408db07a6","targetRecordIds":["record-pi-custom-1"],"contextExcluded":true,"quarantinedValue":{"customType":"fixture.state","data":{"counter":2,"mode":"synthetic"}}},{"sourceLine":10,"sourceEntryId":"pi-custom-message-1","sourceType":"custom_message","disposition":"quarantined","reasonCodes":["custom_message_context_excluded"],"sourceLineSha256":"eaa3e0350b9fc50d4ecb60ce5845fad375c6af6fc986c71be4c7c9edb60b36f8","targetRecordIds":["record-pi-custom-message-1"],"contextExcluded":true,"quarantinedValue":{"customType":"fixture.context","content":"[SYNTHETIC_CUSTOM_CONTEXT]","display":true,"details":{"origin":"synthetic"}}},{"sourceLine":16,"sourceEntryId":"pi-label-1","sourceType":"label","disposition":"preserved_extension","reasonCodes":["label_semantics_extension_only"],"sourceLineSha256":"38aa365bd9db274ea5fefcc397c57e0303e7f515a7012bd85c97adf608b5dd74","targetRecordIds":["record-pi-label-1"],"contextExcluded":true,"quarantinedValue":{"targetId":"pi-user-2","label":"synthetic-checkpoint"}},{"sourceLine":18,"sourceEntryId":"pi-unknown-1","sourceType":"future_entry","disposition":"quarantined","reasonCodes":["unknown_entry_type"],"sourceLineSha256":"cc3ae1f8668bcfa4785d08dd619a8ae07e3e5810cc354c7e0a4e2ec37a1281ff","targetRecordIds":["record-pi-unknown-1"],"contextExcluded":true,"quarantinedValue":{"payload":{"format":"synthetic","value":7}}}]}
